[
  {
    "id": "q-1.1-101",
    "domain": 1,
    "task_statement": "1.1",
    "scenario": "Your agent's loop is correct in shape: it checks `stop_reason`, and while it is `\"tool_use\"` it executes tools and iterates. In one turn Claude emits three `tool_use` blocks in a single assistant message. Your executor runs them, then appends three separate `user` messages, each containing one `tool_result`, before making the next API call. The API rejects the request.",
    "stem": "What is wrong with the loop, and what is the minimal fix?",
    "options": [
      {
        "key": "A",
        "text": "Three parallel `tool_use` blocks in one message is itself the error — set `tool_choice` to a forced single tool so the model can only request one call per turn, then the one-result-per-message pattern is valid."
      },
      {
        "key": "B",
        "text": "The executor is running the three tools concurrently; Claude expects them resolved in emission order, so serialize execution and append each result as its own message in that order."
      },
      {
        "key": "C",
        "text": "Batch all three `tool_result` blocks into one user message: every `tool_use` block from a single assistant message must be answered together."
      },
      {
        "key": "D",
        "text": "The results are being appended with the `user` role; parallel tool results must be appended with the `assistant` role so they attach to the message that requested them."
      }
    ],
    "correct": "C",
    "rationale": {
      "correct": "Parallel tool calls are a single logical turn. All `tool_use` blocks emitted in one assistant message must be satisfied by `tool_result` blocks carried in the immediately following user message, correlated by `tool_use_id`. Emitting one result per message leaves outstanding calls unanswered at the first boundary, which is invalid. Batching the three results into one user message is the whole fix — the rest of the loop is already correct.",
      "distractors": {
        "A": "Forcing a single tool per turn would sidestep the symptom by preventing parallelism, but it is a large capability regression to work around a message-assembly bug, and the question asks for the minimal fix. Parallel `tool_use` is a supported, desirable behavior.",
        "B": "Concurrent execution is exactly what parallel `tool_use` blocks are for, and there is no ordering requirement between them. Serializing costs the latency benefit and does not address the message-structure violation, so the request still fails.",
        "D": "Tool results are always returned in a `user`-role message; the `assistant` role is what the model produces. Changing the role would not correlate results to calls and would corrupt the conversation structure."
      }
    },
    "lab": "lab-03-agentic-loop",
    "difficulty": 8,
    "tags": [
      "agentic-loop",
      "parallel-tool-use",
      "tool_result",
      "message-structure",
      "diagnose"
    ]
  },
  {
    "id": "q-1.1-102",
    "domain": 1,
    "task_statement": "1.1",
    "scenario": "An extraction agent occasionally returns a truncated answer and stops. Your loop treats any `stop_reason` other than `\"tool_use\"` as completion and returns the last assistant message to the caller. Reviewing failed runs, you find the responses that were cut short all carry `stop_reason: \"max_tokens\"`, and several were cut off partway through emitting a `tool_use` block.",
    "stem": "What should the loop do differently?",
    "options": [
      {
        "key": "A",
        "text": "Raise `max_tokens` until truncation stops occurring in testing, keeping the existing two-state loop."
      },
      {
        "key": "B",
        "text": "Treat `\"max_tokens\"` as its own terminal state, not as completion — the turn is incomplete and any partial `tool_use` is unusable."
      },
      {
        "key": "C",
        "text": "Switch loop control from `stop_reason` to checking whether the assistant message contains any `tool_use` blocks; if it does, execute them, and otherwise finish."
      },
      {
        "key": "D",
        "text": "Continue the loop on `\"max_tokens\"` exactly as it does on `\"tool_use\"`, executing whatever partial tool call was emitted and appending the result so the model can carry on."
      }
    ],
    "correct": "B",
    "rationale": {
      "correct": "The loop conflates 'not `tool_use`' with 'done', which silently promotes a truncated response to a final answer. `\"max_tokens\"` means the model ran out of budget mid-generation: the turn did not complete and a partially emitted `tool_use` block cannot be executed. It needs its own branch that fails loudly or retries with more budget, rather than being swallowed by the completion path.",
      "distractors": {
        "A": "Raising the budget reduces how often truncation happens but leaves the loop unable to recognize it when it does. This is a defensible mitigation and worth doing alongside the fix, but on its own it still returns corrupt output whenever a response exceeds the new ceiling.",
        "C": "Presence of `tool_use` blocks is a reasonable-looking proxy and would keep the loop iterating in the normal case, but it collapses the same distinction from the other side — a truncated turn with no complete `tool_use` block still exits as if finished. `stop_reason` is the structured signal precisely so these states stay distinguishable.",
        "D": "Executing a partially emitted `tool_use` block is unsafe: the input JSON may be incomplete or malformed, so arguments could be missing or wrong. This trades a visible truncation for a silent incorrect tool invocation."
      }
    },
    "lab": "lab-03-agentic-loop",
    "difficulty": 9,
    "tags": [
      "agentic-loop",
      "stop_reason",
      "max_tokens",
      "truncation",
      "diagnose"
    ]
  },
  {
    "id": "q-1.1-103",
    "domain": 1,
    "task_statement": "1.1",
    "scenario": "A support agent's loop appends tool results as plain text lines appended to the running conversation, in the form `Result: {json}`, rather than as structured `tool_result` content correlated by `tool_use_id`. It works in single-tool turns. Once the agent begins issuing two lookups per turn, it starts attributing one order's shipping status to the other order.",
    "stem": "What explains the misattribution?",
    "options": [
      {
        "key": "A",
        "text": "The two lookups race, and results are appended in completion order rather than request order, so the model reads them in the wrong sequence."
      },
      {
        "key": "B",
        "text": "Tool results appended as text are treated as user instructions rather than observations, causing the model to follow them as directives instead of reasoning over them."
      },
      {
        "key": "C",
        "text": "The results are consuming context disproportionate to their relevance, and the lost-in-the-middle effect is dropping the second lookup's fields."
      },
      {
        "key": "D",
        "text": "Plain-text results drop the `tool_use_id` binding each result to its call, so with two outstanding calls the model must guess."
      }
    ],
    "correct": "D",
    "rationale": {
      "correct": "`tool_result` blocks carry a `tool_use_id` that ties each result back to the exact `tool_use` block that requested it. Flattening results into text discards that binding. With a single outstanding call the association is unambiguous so the bug stays hidden; with two, nothing in the transcript states which payload answers which call, and the model infers it from ordering and content cues that frequently mislead.",
      "distractors": {
        "A": "Completion-order interleaving would make the guessing worse, so this is a real aggravating factor and a reasonable suspicion. But ordering is only load-bearing because the correlation is missing — restore `tool_use_id` binding and arrival order stops mattering.",
        "B": "Appended text does become part of the conversation rather than a typed observation, which is a genuine downside of this approach and can shift how the model weights it. It does not explain why the failure appears only once there are two concurrent lookups, which is the specific pattern to account for.",
        "C": "Context bloat and position effects are real concerns for verbose tool output, but they would degrade recall gradually and unpredictably rather than producing a clean swap of two fields between two orders in the same turn."
      }
    },
    "lab": "lab-03-agentic-loop",
    "difficulty": 8,
    "tags": [
      "agentic-loop",
      "tool_use_id",
      "correlation",
      "parallel-tool-use",
      "diagnose"
    ]
  },
  {
    "id": "q-1.2-102",
    "domain": 1,
    "task_statement": "1.2",
    "scenario": "In a hub-and-spoke research system, the analysis subagent regularly needs one clarifying lookup from the search subagent. Each round trip through the coordinator adds latency, and an engineer proposes letting the two subagents call each other directly to cut it. Your operations team relies on coordinator logs as the single audit trail of what each subagent did and why.",
    "stem": "How should you evaluate the proposal?",
    "options": [
      {
        "key": "A",
        "text": "Keep routing through the coordinator, and give the analysis subagent a narrowly scoped lookup tool for the high-frequency case."
      },
      {
        "key": "B",
        "text": "Reject the change and accept the latency, since hub-and-spoke requires that all inter-subagent communication route through the coordinator."
      },
      {
        "key": "C",
        "text": "Adopt direct peer calls between the two subagents and have each write its own audit records, reconstructing the trail from the union of per-agent logs."
      },
      {
        "key": "D",